{
  "$id": "https://intentcue.dev/schemas/ScreenCapture.schema.json",
  "title": "ScreenCapture",
  "$schema": "https://json-schema.org/draft/2020-12/schema",
  "type": "object",
  "properties": {
    "screenId": {
      "type": "string"
    },
    "platform": {
      "type": "string",
      "enum": [
        "ios",
        "android",
        "web"
      ]
    },
    "device": {
      "type": "object",
      "properties": {
        "name": {
          "type": "string"
        },
        "width": {
          "type": "number"
        },
        "height": {
          "type": "number"
        },
        "scale": {
          "type": "number"
        }
      },
      "required": [
        "name",
        "width",
        "height",
        "scale"
      ],
      "additionalProperties": false
    },
    "screenshot": {
      "type": "string"
    },
    "root": {
      "$ref": "#/$defs/__schema0"
    },
    "capturedAt": {
      "type": "string"
    }
  },
  "required": [
    "screenId",
    "platform",
    "device",
    "screenshot",
    "root",
    "capturedAt"
  ],
  "additionalProperties": false,
  "$defs": {
    "__schema0": {
      "type": "object",
      "properties": {
        "id": {
          "type": "string"
        },
        "idSource": {
          "type": "string",
          "enum": [
            "accessibility",
            "testId",
            "dom",
            "generated"
          ]
        },
        "type": {
          "type": "string"
        },
        "nativeType": {
          "type": "string"
        },
        "label": {
          "type": "string"
        },
        "bounds": {
          "type": "object",
          "properties": {
            "x": {
              "type": "number"
            },
            "y": {
              "type": "number"
            },
            "w": {
              "type": "number"
            },
            "h": {
              "type": "number"
            }
          },
          "required": [
            "x",
            "y",
            "w",
            "h"
          ],
          "additionalProperties": false
        },
        "visible": {
          "type": "boolean"
        },
        "children": {
          "type": "array",
          "items": {
            "$ref": "#/$defs/__schema0"
          }
        },
        "source": {
          "type": "object",
          "properties": {
            "file": {
              "type": "string"
            },
            "line": {
              "type": "integer",
              "minimum": -9007199254740991,
              "maximum": 9007199254740991
            },
            "component": {
              "type": "string"
            }
          },
          "required": [
            "file"
          ],
          "additionalProperties": false
        }
      },
      "required": [
        "id",
        "idSource",
        "type",
        "bounds",
        "visible",
        "children"
      ],
      "additionalProperties": false
    }
  }
}
